{
  "graph_id": "task_graph_demo_notification_001",
  "package_id": "plan_demo_notification_001",
  "version": "1.0.0",
  "phases": [
    {
      "phase_id": "phase_foundation",
      "title": "Foundation",
      "order": 1
    },
    {
      "phase_id": "phase_prototype",
      "title": "Read-only prototype",
      "order": 2
    }
  ],
  "tasks": [
    {
      "task_id": "task_define_permissions",
      "phase_id": "phase_foundation",
      "title": "Define operating-system permission model",
      "objective": "Document which notification settings and app metadata can be read or opened on supported desktop systems.",
      "depends_on": [],
      "priority": "P0",
      "owner_type": "research_agent",
      "inputs": ["product brief", "platform documentation"],
      "outputs": ["permissions matrix"],
      "acceptance_criteria": [
        "Each planned capability is marked supported, unsupported, or uncertain on Windows and macOS."
      ],
      "tests": ["Documentation links and experiment results are recorded."],
      "risk_level": "high",
      "status": "ready"
    },
    {
      "task_id": "task_inventory_prototype",
      "phase_id": "phase_prototype",
      "title": "Build local notification settings inventory",
      "objective": "Create a privacy-preserving desktop prototype that lists supported app notification settings and opens the relevant system control.",
      "depends_on": ["task_define_permissions"],
      "priority": "P0",
      "owner_type": "coding_agent",
      "inputs": ["permissions matrix", "UI reference"],
      "outputs": ["desktop prototype", "automated smoke tests"],
      "acceptance_criteria": [
        "The prototype reads no notification content.",
        "Supported settings links open correctly on test systems."
      ],
      "tests": ["Windows smoke test", "macOS smoke test", "privacy assertion test"],
      "risk_level": "medium",
      "status": "planned"
    }
  ],
  "created_at": "2026-07-02T10:30:00Z"
}
